Utterance,Intent,Training/Testing,ML Entity
i donʻt even shop at old navy,,,merchant
i didnʻt buy anything from rei,,,merchant
i never went to kmart,,,merchant
i don't recognize the cvs one,,,merchant
the walgreens one wasn't me,,,merchant
the kmart purchase wasnʻt me,,,merchant
the target one is me,,,merchant
i recognize the kmart purchases,,,merchant
target was me,,,merchant
i made the purchase from walmart,,,merchant
i went to walmart that day,,,merchant
looks good i made the purchase from tjmaxx,,,merchant
I don't recognize that Shell Gas charge from March 17th,,,merchant
"I did go to Ann Taylor,",,,merchant
I made the purchase from macyʻs,,,merchant
the transaction on amazon was me,,,merchant
i never bought anything from trader joeʻs,,,merchant
i donʻt shop at trader joeʻs,,,merchant
i purchased that from walmart yesterday,,,merchant
the purchase from macyʻs was me,,,merchant
i recognize the transaction from target,,,merchant
i did make the purchase from walmart,,,merchant
i was at jc penny yesterday so that was me,,,merchant
i recognize the purchase at dickʻs sporting goods,,,merchant
i made the purchase from kroger,,,merchant
i bought something from belk,,,merchant
i donʻt recognize this one from applebeeʻs,,,merchant
i never shop at walmart,,,merchant
i donʻt even shop at cardenaʻs,,,merchant
there isnʻt even a five guys near me,,,merchant
the rei purchase defintely wasnʻt me,,,merchant
i donʻt buy things from amazon,,,merchant
dumb question but how do I see how much I have in my main checking account with you guys,account_balance,Training,account_name
can you tell me how much I have on alt account now,account_balance,Training,account_name
balance of emergency savings acct,account_balance,Training,account_name
i want to check my balance but not on my main account,account_balance,Training,account_name
Show my my balance on piggybank,account_balance,Training,account_name
need to check balance of college savings account,account_balance,Training,account_name
would like to know how much is in my college savings account,account_balance,Training,account_name
would like to know balance of my husbandʻs account,account_balance,Training,account_name
how much do i have in my retirement account,account_balance,Training,account_name
need to check balance of my vacation account,account_balance,Training,account_name
need to check the balance of my main savings account,account_balance,Training,account_name
what's the balance on my main savings account,account_balance,Training,account_name
show me balance of college savings acct please,account_balance,Training,account_name
Still something on acount B? havenʻt checked in awhile,account_balance,Training,account_name
my baby account balance,account_balance,Training,account_name
How do I see my baby account balance,account_balance,Training,account_name
How much left on my baby account,account_balance,Training,account_name
iʻd like my husbandʻs account,account_choice,Training,account_name
my main account,account_choice,Training,account_name
the vacation account,account_choice,Training,account_name
use my backup account,account_choice,Training,account_name
from the college savings acct,account_choice,Training,account_name
from my new car savings acct,account_choice,Training,account_name
i'd like my wife's acct,account_choice,Training,account_name
can i see my car savings account,account_choice,Training,account_name
I want to see my christms account,account_choice,Training,account_name
please show my primary checking,account_choice,Training,account_name
need to see secondary savings,account_choice,Training,account_name
can i see my fun account,account_choice,Training,account_name
i wanna see my backup account,account_choice,Training,account_name
show my checking account balance for vacation,account_choice,Training,account_name
i want to see my everyday checking,account_choice,Training,account_name
my everyday checking acct,account_choice,Training,account_name
show my everyday checking,account_choice,Training,account_name
can you make that portfolio checking instead,account_choice,Training,account_name
portfolio checking account,account_choice,Training,account_name
go to my preferred checking account,account_choice,Training,account_name
"preferred checking account, please",account_choice,Training,account_name
go to my platinum savings please,account_choice,Training,account_name
need to view my platinum savings,account_choice,Training,account_name
how much is in my emergency savings account,account_balance,Training,account_name
trying to figure out how much i still have on my backup account,account_balance,Training,account_name
need to see my preferred checking,account_choice,Training,account_name
my clear access banking acct,account_choice,Training,account_name
whatʻs the balance on my wifeʻs account,account_balance,Training,account_name
tell me the balance on vacation savings account,account_balance,Training,account_name
how much is there in the baby account,account_balance,Training,account_name
how much money is there in my college savings account,account_balance,Training,account_name
what is available in my secret account,account_balance,Training,account_name
balance in the savings account for my wife,account_balance,Training,account_name
give me the balance in the account for vacation,account_balance,Training,account_name
how much have we saved in our retirement account,account_balance,Training,account_name
our new home account has how much in it,account_balance,Training,account_name
how much money does my wife have in her account,account_balance,Training,account_name
show the vacation account,account_choice,Training,account_name
show my husbandʻs checking account,account_choice,Training,account_name
look up the balance on my vacation account,account_choice,Training,account_name
pull up the second checking account,account_choice,Training,account_name
look at the rainy day account,account_choice,Training,account_name
misplaced my hotels.com rewards visa card,card_choice,Training,card_merchant
hotels.com rewards card,card_choice,Training,card_merchant
i lost my target plus card,replace_card,Training,card_merchant
i need a replacement for the amazon card,replace_card,Training,card_merchant
somebody stole my capital one business card,replace_card,Training,card_merchant
iʻve misplaced my walmart rewards card,replace_card,Training,card_merchant
the united airlines credit card is nowhere to be found,replace_card,Training,card_merchant
hotels.com rewards card,replace_card,Training,card_merchant
my credit card from amazon is missing,replace_card,Training,card_merchant
my credit card for capital one was stolen,replace_card,Training,card_merchant
some thief took my hm credit card,replace_card,Training,card_merchant
it was my walmart credit card,card_choice,Training,card_merchant
my amazon card,card_choice,Training,card_merchant
the frontier credit card,card_choice,Training,card_merchant
frontier rewards,card_choice,Training,card_merchant
amazon card,card_choice,Training,card_merchant
iʻm talking about my walmart card,card_choice,Training,card_merchant
the home depot credit card,card_choice,Training,card_merchant
misplaced my hotels.com rewards visa card,replace_card,Training,card_merchant
somebody stole my amazon plus credit card,replace_card,Training,card_merchant
i need a replacement for the starbucks card,replace_card,Training,card_merchant
are you all able to replace my walmart credit card,replace_card,Training,card_merchant
my jcpenney rewards card is missing,replace_card,Training,card_merchant
it was the capital one rewards card,card_choice,Training,card_merchant
iʻm talking about my amazon card,card_choice,Training,card_merchant
the macyʻs special card,card_choice,Training,card_merchant
talking about the walmart credit card,card_choice,Training,card_merchant
itʻs the target plus credit card,card_choice,Training,card_merchant
i lost my home depot credit card,replace_card,Training,card_merchant
it was my amazon card,card_choice,Training,card_merchant
walmart credit card,card_choice,Training,card_merchant
the target rewards card,card_choice,Training,card_merchant
I think I lost my hm credit card,replace_card,Training,card_merchant
it was my Best Buy credit card,card_choice,Training,card_merchant
the Best Buy card,card_choice,Training,card_merchant
Hi I need to report my Banana Republic credit card as lost,replace_card,Training,card_merchant
it was my Banana Republic credit card,card_choice,Training,card_merchant
unable to find my Kohl's Credit Card,replace_card,Training,card_merchant
my Kohl's card,card_choice,Training,card_merchant
Hi I had a Sam's Club Consumer Credit Card but I think I lost it,replace_card,Training,card_merchant
on my Sam's Club card,card_choice,Training,card_merchant
I had used my JCPenney rewards card for it,card_choice,Training,card_merchant
i donʻt shop at target,list_choice,Training,merchant
i never go to old navy,list_choice,Training,merchant
amazon purchases werenʻt me,list_choice,Training,merchant
i bought something from walmart,list_choice,Training,merchant
the amazon transaction was me,list_choice,Training,merchant
i donʻt even shop at old navy,list_choice,Training,merchant
i didnʻt buy anything from rei,list_choice,Training,merchant
i never went to kmart,list_choice,Training,merchant
i don't recognize the cvs one,list_choice,Training,merchant
the walgreens one wasn't me,list_choice,Training,merchant
the kmart purchase wasnʻt me,list_choice,Training,merchant
the target one is me,list_choice,Training,merchant
i recognize the kmart purchases,list_choice,Training,merchant
target was me,list_choice,Training,merchant
i made the purchase from walmart,list_choice,Training,merchant
i went to walmart that day,list_choice,Training,merchant
looks good i made the purchase from tjmaxx,list_choice,Training,merchant
I didn't make that Macy's purchase,list_choice,Training,merchant
I didn't buy anything from REI or Macy's,list_choice,Training,merchant
i donʻt shop at target,list_choice,Training,merchant
i never go to old navy,list_choice,Training,merchant
amazon purchases werenʻt me,list_choice,Training,merchant
i bought something from walmart,list_choice,Training,merchant
the amazon transaction was me,list_choice,Training,merchant
i donʻt even shop at old navy,list_choice,Training,merchant
i didnʻt buy anything from rei,list_choice,Training,merchant
i never went to kmart,list_choice,Training,merchant
i don't recognize the cvs one,list_choice,Training,merchant
the walgreens one wasn't me,list_choice,Training,merchant
the kmart purchase wasnʻt me,list_choice,Training,merchant
the target one is me,list_choice,Training,merchant
i recognize the kmart purchases,list_choice,Training,merchant
target was me,list_choice,Training,merchant
i made the purchase from walmart,list_choice,Training,merchant
i went to walmart that day,list_choice,Training,merchant
looks good i made the purchase from tjmaxx,list_choice,Training,merchant
I don't recognize that Shell Gas charge from March 17th,list_choice,Training,merchant
"I did go to Ann Taylor,",list_choice,Training,merchant
I made the purchase from macyʻs,list_choice,Training,merchant
the transaction on amazon was me,list_choice,Training,merchant
i never bought anything from trader joeʻs,list_choice,Training,merchant
i donʻt shop at trader joeʻs,list_choice,Training,merchant
i purchased that from walmart yesterday,list_choice,Training,merchant
the purchase from macyʻs was me,list_choice,Training,merchant
i recognize the transaction from target,list_choice,Training,merchant
i did make the purchase from walmart,list_choice,Training,merchant
i was at jc penny yesterday so that was me,list_choice,Training,merchant
i recognize the purchase at dickʻs sporting goods,list_choice,Training,merchant
i made the purchase from kroger,list_choice,Training,merchant
i bought something from belk,list_choice,Training,merchant
i donʻt recognize this one from applebeeʻs,list_choice,Training,merchant
i never shop at walmart,list_choice,Training,merchant
i donʻt even shop at cardenaʻs,list_choice,Training,merchant
there isnʻt even a five guys near me,list_choice,Training,merchant
the rei purchase defintely wasnʻt me,list_choice,Training,merchant
i donʻt buy things from amazon,list_choice,Training,merchant
that trader joeʻs purchase,list_choice,Training,merchant
the purchase from target,list_choice,Training,merchant
no to the starbucks transaction,list_choice,Training,merchant
i didnʻt do the purchase from kroger,list_choice,Training,merchant
mcdonalds no,list_choice,Training,merchant
burger king wasnʻt me,list_choice,Training,merchant
recognize the thing from amazon,list_choice,Training,merchant
i went to target yeah,list_choice,Training,merchant
i never go to target,list_choice,Training,merchant
old navy is unfamiliar,list_choice,Training,merchant
do not know the purchase from kohls,list_choice,Training,merchant
the item from burger king is mine,list_choice,Training,merchant
the kroger item was not me,list_choice,Training,merchant